{
  "$schema": "https://json-schema.org/draft/2020-12/schema",
  "$id": "https://rewireperform.com/contracts/mahleos-feedback/v1/feedback-read-success.schema.json",
  "title": "MahleOS feedback read success v1",
  "type": "object",
  "required": [
    "ok",
    "schema_version",
    "request_id",
    "generated_at",
    "items",
    "has_more",
    "next_cursor",
    "privacy"
  ],
  "properties": {
    "ok": {
      "const": true
    },
    "schema_version": {
      "const": "mahleos-feedback-read-v1.1"
    },
    "request_id": {
      "type": "string",
      "pattern": "^[0-9a-f]{8}-[0-9a-f]{4}-[1-5][0-9a-f]{3}-[89ab][0-9a-f]{3}-[0-9a-f]{12}$"
    },
    "generated_at": {
      "type": "string",
      "pattern": "^\\d{4}-\\d{2}-\\d{2}T\\d{2}:\\d{2}:\\d{2}(?:\\.\\d{1,6})?(?:Z|[+-]\\d{2}:\\d{2})$"
    },
    "items": {
      "type": "array",
      "maxItems": 25,
      "items": {
        "type": "object",
        "required": [
          "feedback_reference",
          "category",
          "status",
          "created_at",
          "message",
          "technical_context"
        ],
        "properties": {
          "feedback_reference": {
            "type": "string",
            "pattern": "^[a-f0-9]{64}$"
          },
          "category": {
            "enum": [
              "bug",
              "suggestion",
              "general",
              "other"
            ]
          },
          "status": {
            "enum": [
              "open",
              "reviewed",
              "resolved",
              "unknown"
            ]
          },
          "created_at": {
            "type": "string",
            "pattern": "^\\d{4}-\\d{2}-\\d{2}T\\d{2}:\\d{2}:\\d{2}(?:\\.\\d{1,6})?(?:Z|[+-]\\d{2}:\\d{2})$"
          },
          "message": {
            "type": "string",
            "minLength": 1,
            "maxLength": 2000
          },
          "technical_context": {
            "type": "object",
            "required": [
              "schema_version",
              "runtime",
              "platform",
              "route",
              "online",
              "app_version"
            ],
            "properties": {
              "schema_version": {
                "const": "feedback-technical-context-v1"
              },
              "runtime": {
                "enum": [
                  "native",
                  "standalone",
                  "browser",
                  "unknown"
                ]
              },
              "platform": {
                "enum": [
                  "ios",
                  "android",
                  "web",
                  "unknown"
                ]
              },
              "route": {
                "type": [
                  "string",
                  "null"
                ],
                "pattern": "^/[^?#]{0,159}$"
              },
              "online": {
                "type": [
                  "boolean",
                  "null"
                ]
              },
              "app_version": {
                "type": "string",
                "pattern": "^[A-Za-z0-9_.:/-]{1,96}$"
              }
            },
            "additionalProperties": false
          }
        },
        "additionalProperties": false
      }
    },
    "has_more": {
      "type": "boolean"
    },
    "next_cursor": {
      "type": [
        "string",
        "null"
      ],
      "pattern": "^[A-Za-z0-9_-]{1,256}$"
    },
    "privacy": {
      "type": "object",
      "required": [
        "structured_user_identifiers_exported",
        "recognized_direct_identifiers_redacted",
        "free_text_may_contain_personal_data",
        "admin_notes_exported",
        "attachments_exported",
        "model_safe_without_redaction"
      ],
      "properties": {
        "structured_user_identifiers_exported": {
          "const": false
        },
        "recognized_direct_identifiers_redacted": {
          "const": true
        },
        "free_text_may_contain_personal_data": {
          "const": true
        },
        "admin_notes_exported": {
          "const": false
        },
        "attachments_exported": {
          "const": false
        },
        "model_safe_without_redaction": {
          "const": false
        }
      },
      "additionalProperties": false
    }
  },
  "additionalProperties": false,
  "allOf": [
    {
      "if": {
        "properties": {
          "has_more": {
            "const": true
          }
        },
        "required": [
          "has_more"
        ]
      },
      "then": {
        "properties": {
          "next_cursor": {
            "type": "string",
            "pattern": "^[A-Za-z0-9_-]{1,256}$"
          }
        }
      },
      "else": {
        "properties": {
          "next_cursor": {
            "const": null
          }
        }
      }
    }
  ]
}
